{
  "legacy_operations": [
    "auth.list",
    "auth.status",
    "mail.read",
    "mail.search",
    "mail.query",
    "mail.attachments",
    "mail.mark-read",
    "mail.mark-unread",
    "calendar.get",
    "drafts.list",
    "drafts.read",
    "drafts.save",
    "folders.list",
    "rules.list",
    "rules.get"
  ],
  "legacy_reason": "Predates declared options (issue 1468): these operations still accept undeclared options until value_options/flag_options are declared.",
  "help": [
    "--help"
  ],
  "absent_operations": [
    "drafts.list",
    "drafts.read",
    "drafts.save",
    "drafts.send",
    "drafts.delete",
    "workflow.delta",
    "workflow.read",
    "workflow.categorize",
    "workflow.ensure-categories",
    "workflow.move"
  ],
  "absent_reason": "The tested o365-cli builds differ: the drafts commands exist in none of them, the workflow commands only in the OpenApe Pods builds (ensure-categories only in the newest). Each build is checked for the commands it provides."
}
